{
  "id": "id",
  "transactionId": "transaction id",
  "type": "type",
  "referenceType": "APPLICATION",
  "referenceId": "reference id",
  "accessPoint": {
    "id": "access point id",
    "alternativeId": "access point alternative id",
    "displayName": "access Display Name",
    "ipAddress": "192.168.1.1",
    "userAgent": "Chrome"
  },
  "actor": {
    "id": "actor id",
    "alternativeId": "actor alternative id",
    "type": "actor type",
    "displayName": "actor display name",
    "referenceType": "APPLICATION",
    "referenceId": "actor reference id"
  },
  "target": {
    "id": "target id",
    "alternativeId": "target alternative id",
    "type": "target type",
    "displayName": "target display name",
    "referenceType": "APPLICATION",
    "referenceId": "target reference id"
  },
  "status": "status",
  "timestamp": "1970-01-01T00:00:00Z",
  "environmentId": "DEFAULT",
  "organizationId": "DEFAULT",
  "nodeId": "node-id",
  "nodeHostname": "main.srv.local"
}